title,title_alternative1,title_alternative2,rating,votes,type_serie,cover,state,followers,categories,related,episodes,description,reactions_like,reactions_funny,reactions_love,reactions_surprise,reactions_angry,reactions_sad,reactions_total
Kore ga Watashi no Goshujin-sama,none,none,4.3,102,ANIME,https://www3.animeflv.net/uploads/animes/covers/1526.jpg,FINALIZADO,1425,Comedia|Ecchi|Recuentos de la vida,,12.0,"Yoshitaka, un chico de 14 años, pierde a sus padres en un accidente, y le queda una herencia millonaria y todas las propiedades de sus padres difuntos. Como se siente muy solo, Yoshitaka pone un anuncio en el que contrata personal para la enorme mansión en que vive. Mientras tanto, Mitsuki e Izumi Satawari huyen de casa, pues su padre no acepta a su mascota. Al ver el cartel, inmediatamente aceptan el trabajo, pues ya no tienen hogar. Estas dos lindas chicas, al empezar a trabajar en la mansión, descubren que Yoshitaka es un pervertido fetichista que las obliga a ponerse 'uniformes' que dejan poco a la imaginación. Con el paso de la serie, él empieza a ver el mundo con otros ojos, viendo que las cosas no suceden bajo su absoluto control.",8,5,17,3,0,0,33
Loveless,none,none,4.3,346,ANIME,https://www3.animeflv.net/uploads/animes/covers/1570.jpg,FINALIZADO,3325,Acción|Drama|Fantasía|Misterio|Romance|Shoujo|Sobrenatural|Yaoi,,18.0,"Ritsuka es un chico (12 años) que no cree en la buena fe ni la amistad sincera de las personas, sufrió la perdida de la persona mas querida en su vida y sufre el maltrato de su madre. Soubi es un joven de 21 años,estudiante de dibujo que conoció al hermano de ritsuka y ahora se presenta ante el prometiéndole entregarle su cuerpo y hasta su vida, además de decirle que peleara por el robándole su primer beso.Asi comenzaran a aparecer enemigo contra los que Soubi y Ritsuka tendrán que combatir",38,1,266,16,10,5,336
Ichigo 100%,いちご100%,Strawberry 100%,4.3,161,ANIME,https://www3.animeflv.net/uploads/animes/covers/583.jpg,FINALIZADO,1232,Comedia|Ecchi|Harem|Romance|Shounen,,18.0,"La historia trata sobre un joven llamado Manaka Junpei, un estudiante de secundaria que no tiene mucho éxito con las mujeres. Desde niño siempre a tenido la ilusión de ser un gran cineasta reconocido, es por eso que al terminar la secundaria, piensa entrar a la preparatoria Izumisaka la cuál tiene un club de cine. Un día, Junpei sube a la azotea de la escuela, y de repente, le cae de encima una preciosa chica con panties con fresas alrededor (Ichigo es fresa en japones). Junpei queda muy asombrado ante la belleza de la joven, la cual le da mucha verguenza y se va corriendo. Al parecer, accidentalmente, la joven olvida su cuaderno y Junpei se entera que el cuaderno pertenece a Toujo Aya, asi que decide buscarla al día siguiente para saber la identidad de la joven.",4,4,25,1,3,0,37
https://www3.animeflv.net/anime/eyeshield-21,none,none,0,0,none,none,404 not found,0,,,0.0,none,0,0,0,0,0,0,0
Sousei no Aquarion,none,none,4.2,81,ANIME,https://www3.animeflv.net/uploads/animes/covers/1451.jpg,FINALIZADO,865,Acción|Ciencia Ficción|Mecha|Romance|Sobrenatural|Superpoderes,Aquarion Evol (Secuela)|Sousei no Aquarion: Uragiri no Tsubasa (Historia Paralela),26.0,"La Humanidad perdió dos terceras partes de su población debido a un desastre natural: el hielo del continente Antártico se derritió y apareció la Atlántida, la civilización desaparecida hace 12.000 años. Debido a esto, revivieron los Ángeles Caídos, una raza de seres alados que envían unas armas biomecánicas conocidas como Bestias Míticas a las ciudades para capturar a la gente y extraer la energía biológica Prana. Los humanos excavaban en las profundidades del océano para encontrar las Máquinas Vectoriales (Vectores), unas armas que se decía que eran capaces de vencer a los Ángeles Caídos. Estas máquinas se combinan y forman el Ángel Aquarion Mecánico. Para pilotar el Aquarion hace falta una persona con la habilidad Elemento compatible con el sistema; por eso se reunió a adolescentes candidatos a ser pilotos. Por fin, llegó el día en el que el Ángel Aquarion Mecánico apareció.",7,1,15,0,0,0,23
Elemental Gelade,エレメンタル ジェレイド,Erementar Gerad,4.6,115,ANIME,https://www3.animeflv.net/uploads/animes/covers/1042.jpg,FINALIZADO,829,Aventuras|Comedia|Fantasía|Magia|Romance|Superpoderes,,26.0,"Coud, un joven pirata del cielo que por accidente descubre a Ren, una adilraid que es capaz de de transformarse en una poderosa arma. Juntos inician un viaje hacia la tierra legendaria Adil Garden, en cual enfrentaran a muchos y poderosos enemigos. ¿Podrán llegar?¿Qué pasara en su viaje?",6,2,18,0,1,2,29
Comic Party Revolution,none,none,4.2,13,ANIME,https://www3.animeflv.net/uploads/animes/covers/1743.jpg,FINALIZADO,75,Comedia|Drama,Comic Party (Precuela),13.0,"Sendo Kazuki suspende el examen de entrada a la escuela de arte, así que su amigo Kuhonbutsu Taishi le hace entrar en el mundo de los doujins (publicaciones privadas).",2,0,2,0,0,0,4
The Law of Ueki,Ueki no Housoku,none,4.5,205,ANIME,https://www3.animeflv.net/uploads/animes/covers/1393.jpg,FINALIZADO,1753,Aventuras|Comedia|Drama|Shounen|Sobrenatural,,51.0,"Kosuke Ueki, un chico normal que vive en Japón, vive una vida normal, amigos normales... pero él se siente diferente. Un día, un nuevo profesor, el profesor Kobayashi, se interesa en Ueki tras saber que él lo que más desea es justicia en el mundo. Tras esto, le revela a Ueki su verdadera identidad; Kobayashi es un candidato a Dios Supremo, y para conseguir el puesto, debe elegir a un chico para que le represente como tal en un torneo donde todos los chicos elegidos por los candidatos a Dios deberán enfrentarse. Así, el profe Koba le da a Ueki el poder de convertir la basura en árboles, con el que deberá luchar y saber usar inteligentemente. Y así, fue como comenzó la nueva vida de Ueki...",3,2,25,2,0,0,32
Izumo Takeki Tsurugi no Senki,IZUMO -猛き剣の閃記-,none,3.8,26,ANIME,https://www3.animeflv.net/uploads/animes/covers/666.jpg,FINALIZADO,243,Artes Marciales|Aventuras|Drama|Fantasía|Romance|Sobrenatural,,12.0,"Takeru es un huerfano que es acogido por Rokunushuke, maestro de kendo siendo el favorito de todos. Su amigo del orfanato, Takeshi es todo su opuesto y en su primera lucha, Takeru despierta en su instituto medio destruido al ser mandado a un mundo bastante extraño. Encuentra a sus amigos despues de encontrarse con varios peligros y apartir de aqui tendra que enfrentarse a miles de peligros para lograr salir con vida de ahy.",3,0,2,2,3,0,10
Izumo: Takeki Tsurugi no Senki,IZUMO -猛き剣の閃記-,none,4.6,29,ANIME,https://www3.animeflv.net/uploads/animes/covers/1647.jpg,FINALIZADO,285,Artes Marciales|Aventuras|Drama|Fantasía|Romance|Sobrenatural,,12.0,"Takeru es un huérfano que es acogido por Rokunushuke, maestro de kendo siendo el favorito de todos. Su amigo del orfanato, Takeshi es contrario a él y en su primera lucha, Takeru despierta en su instituto medio destruido al ser mandado a un mundo bastante extraño. Encuentra a sus amigos después de encontrarse con varios peligros y a partir de aquí tendrá que enfrentarse a miles de peligros para lograr salir con vida de ahí.",8,0,2,0,2,0,12
Koi Koi 7,こいこい7,none,4.5,53,ANIME,https://www3.animeflv.net/uploads/animes/covers/62.jpg,FINALIZADO,517,Comedia|Harem|Romance,,13.0,"Tanaka Tetsuro en su primer día de clase: todos los alumnos, menos él, son chicas. Está en el paraíso Lejos de su familia lo veía como un escape hacia la paz, pero no va a ser así. El problema es que no sabe que su nueva escuela esta llena de mujeres, de hecho él es el único hombre en ella. Ahora será constantemente acosado y quedará en el medio de una guerra entre estudiantes que para complicar aún más las cosas son dueñas de poderes increíbles.",5,1,3,0,0,1,10
Karas,鴉 -KARAS-,The Karas,4.3,48,ANIME,https://www3.animeflv.net/uploads/animes/covers/300.jpg,FINALIZADO,301,Acción|Ciencia Ficción|Fantasía,,6.0,"Karas es una animacion de seis partes de henshin, del genero tipo superheroe japones. Karas trata de la historia de Otoha, un yakuza, viviendo en una versión ficticia de Shinjuku, Tokyo, ciudad poblada por humanos y yōkai (Espirítus Japoneses). Otoha, es uno de los karas, humanos superpoderosos que actuan como agentes de la tierra y también se puede transformar en un vehiculo, avión y en un tanke blindado. Otoha siendo un karas, es un hábil espadachín que intenta detener a su corrupto predecesor, de tomar Tokyo. Entre otros personajes se encuentran: Nue, el yōkai; y Homura, la karas de otra ciudad, ellos ayudan a Otoha en su misión. La serie tambíen contiene una historia paralela que se enfoca en como los humanos son afectados por las actuaciones de Eko.",10,1,7,1,0,0,19
Bokusatsu Tenshi Dokuro-chan,撲殺天使ドクロちゃん,Bludgeoning Angel Dokuro-chan,4.5,269,ANIME,https://www3.animeflv.net/uploads/animes/covers/206.jpg,FINALIZADO,2910,Comedia|Ecchi|Magia,Bokusatsu Tenshi Dokuro-chan 2 (Secuela),4.0,"La chica ángel del futuro, quien tiene la misión de asesinar al creador del secreto para la juventud eterna es Dokuro-chan. Sin embargo ella es incapaz de cumplir su misión debido a sus sentimientos, entonces decide hacerlo a su manera. Es aquí donde veremos una historia llena de diversión, romance, aventura y mucha sangre.Ella nos enseñara una forma muy peculiar de mostrar afecto hacia los demás.",16,18,55,4,2,3,98
Sentou Yousei Shoujo Tasukete! Mave-chan,none,none,4.2,6,OVA,https://www3.animeflv.net/uploads/animes/covers/1956.jpg,FINALIZADO,96,Ciencia Ficción|Comedia|Parodia|Shounen|Superpoderes,,1.0,"Sugiyama Rei es un muchacho que vive en una pequeña ciudad del interior. Por su personalidad retraída y tímida encuentra en el anime una vía de escape. Un día envía un cupón que vino en unos de sus DVDs y gana la entrada a un evento de unos animes (Yukikaze y Stratos 4) en Akihabara. En ese momento siente que la salida a la gran ciudad sería una oportunidad para cambiar su forma de ser y decide ir al festival. Al llegar al lugar se sorprende por la gran cantidad de personas congregadas y, sintiéndose agobiado, decide ir al baño a relajarse un poco... Sin embargo, al entrar allí, se da cuenta que está en un lugar extraño, como un campo de batalla. Sin dar crédito a lo que está viviendo, es de pronto atacado por una extraña chica, siendo finalmente salvado por otra. Ésta, llamada Super Sylph, al preguntarle Rei por lo que está pasando, le dice que ellas son personalizaciones creadas por la pasión de los otakus. Sin embargo, luchan para no ser olvidadas, ya que si lo son desaparecerán... Rei, que se siente agradecido al anime, decide devolverle el favor ayudándola...",5,0,4,0,0,0,9
Kino no Tabi: Nanika wo Suru Tame ni - Life Goes On,none,none,4.6,42,OVA,https://www3.animeflv.net/uploads/animes/covers/2324.jpg,FINALIZADO,421,Aventuras|Drama|Fantasía,Kino no Tabi (Secuela),1.0,Precuela de la serie donde vemos a Kino ser entrenada por su maestra. Ahí aprende cómo montar a Hermes y consigue una excelente puntería que le será de gran ayuda para defenderse a lo largo de sus viajes. Será entonces cuando decide echarse a la carretera.,9,1,9,3,0,0,22
Futari wa Precure: Max Heart,none,none,4.6,56,ANIME,https://www3.animeflv.net/uploads/animes/covers/1691.jpg,FINALIZADO,357,Acción|Comedia|Fantasía|Magia|Shoujo,Futari wa Precure (Precuela),47.0,"En esta segunda parte de Pretty Cure, la Reina decide convertirse en su forma original, pero su hesencia se divide en varias partes, las cuales son: Doce Hartiels (los deseos de la Reina) la resurrecion de voluntad, y la vida de la Reina. Pero por desgracia el Rey Haaku también obtiene una Vida. La Vida de la Reina es una niña llamada Hikari Kujou, que estudia primer curso, a la cual Akane encontro cerca del Takko Caffe y, ahora, trabajan juntas. Hikari se convierte en una Pretty Cure gracias a Porun, y su nombre es Shiny Luminosa, más tarde encuentra a Lulum, que le da mas poder. Para Shiny Luminosa es imposible atacar, solo puede aumentar el poder de Cure Black y Cure White con su Batuta Corazón. Las Pretty Cure intentan reunir todos los Hartiels para que Hikari vuelva a ser la Reina, y todo vuelva a ser como antes.",6,2,23,0,0,0,31
Gekijouban Tennis no Ouji-sama: Futari no Samurai - The First Game,The Prince of Tennis - Two Samurai: The First Game,劇場版 テニスの王子様 二人のサムライ The First Game,4.4,51,PELÍCULA,https://www3.animeflv.net/uploads/animes/covers/1594.jpg,FINALIZADO,338,Acción|Deportes|Shounen,The Prince of Tennis (Historia Principal),1.0,"Es la primera película de la serie. En esta película el equipo Seigaku es invitado a un crucero por un millonario para un partido contra su propio equipo, en el que está Ryoga Echizen, hermano mayor de Ryoma.",19,0,39,1,1,1,61
"Iriya no Sora, UFO no Natsu","イリヤの空, UFOの夏","Sky of Iriya, Summer of UFO",4.2,42,OVA,https://www3.animeflv.net/uploads/animes/covers/568.jpg,FINALIZADO,303,Ciencia Ficción|Drama|Romance,,6.0,"La historia empieza cuando Asaba Naoyuki entra una noche en la piscina de su colegio, y conoce a una misteriosa chica, Irino Kana, la cual tiene unas esferas de cristal en las muñecas. Al comienzo del nuevo semestre escolar, transfieren a Kana a la misma clase que Naoyuki. Kana tiene grandes problemas para relacionarse con sus nuevos compañeros, sin embargo, con Naoyuki es diferente y entablan una gran amistad... ¿o algo más? Pero Kana no es una chica normal. Es llamada constantemente por los profesores, tiene reacciones muy poco frecuentes y un hombre vestido de negro siempre acude a ayudarla cuando está en apuros. ¿Será que tiene un destino del cual no puede escapar? ¿Tendrá relación con la misteriosa base militar o con el incidente con un OVNI?",1,0,9,1,0,2,13
Guardian Hearts Power UP!,がぁーでぃあんHearts ぱわーあっぷ!,none,4.5,17,OVA,https://www3.animeflv.net/uploads/animes/covers/1477.jpg,FINALIZADO,109,Acción|Comedia|Ecchi|Fantasía|Harem|Magia|Romance,Guardian Hearts (Precuela),2.0,"Secuela de Guardian Hearts, que continúan con las aventuras de Kazuya.",3,0,3,0,0,0,6
Mahoraba Heartful days,none,none,4.6,33,ANIME,https://www3.animeflv.net/uploads/animes/covers/2139.jpg,FINALIZADO,197,Comedia|Drama|Romance|Shounen,,26.0,"Shiratori Ryuji quiere convertirse en un ilustrador, para lo que se traslada a un apartamento, Narutaki-so, de modo que pueda asistir a un colegio de artes en Tokio. Narutaki-so es una antigua casa japonesa que no encaja con el entorno urbano. El dueño es el primo de su madre y la encargada del apartamento es Aoba Kozue. Son primos segundos y se conocieron hace mucho cuando ambos eran niños, aunque ya no se recuerdan muy bien. Ella está en segundo curso de un instituto pegado al que era su antiguo colegio. Hay cinco personas mas viviendo en Narutaki-so. La primera, Chanohata Kotomi, que vive en la habitación #1. Es la mejor amiga de Kozua. La residente de la habitación #3 es Momono Megumi, y es el tipo de persona que siempre hace las cosas a su manera. En la habitacion #5, estan Kurosaki Sayoko y su hija Asami, que va al primer curso del colegio. Y finalmente, en la habitacion numero #6, Haibara Yukio, que vive con su muñeco, ""Johnny"".",3,1,5,1,0,0,10
Suki na Mono wa Suki Dakara Shou ga Nai!!,好きなものは好きだからしょうがない!!,none,4.3,219,ANIME,https://www3.animeflv.net/uploads/animes/covers/1602.jpg,FINALIZADO,1522,Comedia|Drama|Recuentos de la vida|Romance|Shoujo|Yaoi,,13.0,"Hashiba Sora es un estudiante de un instituto privado de hombres. Un dia tiene un accidente en el que cae del cuarto piso de la escuela y sufre una pérdida de memoria, la mayoría recuerdos de una horrible y misteriosa infancia. Cuando sale del hospital, una noche mientras duerme, es despertado por su nuevo compañero de habitación. El muchacho esta colocado encima suyo. El chico se llama Sunao Fujimori y es su amigo de la infancia. Sora le dice que no recuerda nada. Lo que ellos no saben, o al menos Sora, es que una misteriosa doble personalidad se esconde en el cuerpo de cada muchacho y que, poco a poco, los iran conduciendo a enamorarse el uno del otro y a recordar la dura infancia de Sora y Sunao. Además éstas personalidades (llamadas Ran y Yoru) están enamoradas la una de la otra, lo que llevará a situaciones cómicas y bastante incómodas para sus protagonistas.",12,3,99,4,3,1,122
Peach Girl,none,none,4.4,283,ANIME,https://www3.animeflv.net/uploads/animes/covers/1514.jpg,FINALIZADO,2280,Drama|Recuentos de la vida|Romance|Shoujo,,25.0,"Momo es una chica de piel morena que anteriormente formo parte del equipo de natación de su escuela. Por el aspecto de su piel los chicos la toman por mujer fácil. Ella esta enamorada en secreto de Touji, el chico serio de la clase a quien también le gusta Momo pero que no se atreve a decirlo,pero lo demuestra defendiéndola de los demás chicos de la escuela. Por azares del destino aparece en escena Okayazu, el chico popular de la escuela quien desde que Momo lo salvo de morir ahogado ha vivido enamorado de ella y que por error le roba su primer beso. A través del anime, Momo va descubriendo que siente mas por Okayasu de lo que ella pensaba y pronto ella tiene que decidir con cual de los dos chicos quiere vivir su historia de amor",22,4,123,7,9,5,170
Air TV,AIR,Air,4.4,225,ANIME,https://www3.animeflv.net/uploads/animes/covers/16.jpg,FINALIZADO,1804,Drama|Recuentos de la vida|Romance|Sobrenatural,Air in Summer (Historia Paralela),13.0,"Kunisaki Yukito es un viajero que está buscando a la ""chica en el aire"" de una leyenda familiar. Su viaje le lleva a una pequeña ciudad costera donde conoce a Misuzu, una chica impaciente por ser su amiga. Una historia de hace miles de años empieza a revelarse tras su extraña relación.",17,0,40,3,1,23,84
Aa! Megami-sama! (TV),Oh My Goddess!,"¡Oh, Mi Diosa!",4.6,181,ANIME,https://www3.animeflv.net/uploads/animes/covers/90.jpg,FINALIZADO,1475,Comedia|Magia|Romance|Seinen|Sobrenatural,Aa! Megami-sama!: Sorezore no Tsubasa (Secuela)|Aa! Megami-sama! (Resumen),26.0,"La historia se centra en Keiichi Morisato, en un inicio estudiante universitario, aficionado a las motocicletas. Un día, Keiichi llama accidentalmente a una ""línea de ayuda técnica de las diosas"", intentaba encargar comida a domicilio. Y la hermosa diosa Belldandy aparece detrás de él, ofreciéndole un deseo. Asumiendo que es una broma, Keiichi desea que Belldandy (que encuentra muy atractiva) permanezca con él para siempre, y su deseo es inmediatamente concedido. Esto se complica cuando las hermanas de Belldandy, Urd y Skuld, se mudan con ellos, trayéndoles muchísimos más problemas.",8,2,25,0,0,1,36
Xenosaga The Animation,ゼノサーガ THE ANIMATION,none,4.0,35,ANIME,https://www3.animeflv.net/uploads/animes/covers/499.jpg,FINALIZADO,252,Acción|Ciencia Ficción|Espacial|Mecha|Shounen,,12.0,"Estamos en un futuro lejano, hace mucho que la Humanidad abandonó la Tierra y vive en el espacio. Shion Uzuki, un miembro de élite de Vector, se ve arrastrado a una lucha por la búsqueda de una misteriosa fuente de energía, debido a un ataque a su nave por parte de los Gnosis. Los Gnosis son una raza alienígena de la que apenas se sabe nada, aparte de que tienen forma fantasmagórica. Aunque, por suerte, Shion no tendrá que enfrentarse sólo a todo esto. Le acompañarán su creación, KOS-MOS, el exterminador de Gnosis definitivo; MOMO, una Realian observadora con la forma de una niña pequeña; Ziggy, un humano que decidió continuar su vida en forma robótica; CHAOS, un chico joven y misterioso capaz de destruir a los Gnosis; y JR, un miembro de la 'Fundación Kukai', que se encargará de la salud de Shion durante el viaje.",3,1,8,0,2,2,16
Mahou Sensei Negima!,魔法先生 ネギま!,Negima!,4.5,182,ANIME,https://www3.animeflv.net/uploads/animes/covers/510.jpg,FINALIZADO,2588,Comedia|Ecchi|Escolares|Fantasía|Harem|Magia|Romance|Shounen|Sobrenatural|Superpoderes,Negima!? (Precuela),26.0,"Decidido a convertirse en un Magister Magi (Mago Maestro). Y tras 7 años de estudios y entrenamiento en la escuela de magos, llega la prueba final, el último y más duro examen para llegar a ser un gran Magister Magi. El maestro instructor reparte a cada aspirante sus destinos y su misión que deberán cumplir. Y a Negi le corresponde ser profesor de inglés en la escuela Mahora en Japón, una escuela femenina. Además deberá tener cuidado de que nadie descubra que es un mago ya que podría suponer que le convirtieran en comadreja. Y así es como un niño de 10 años, nacido en Gales, con poderes mágicos y un nivel de inteligencia equivalente al de la universidad, se convierte en profesor de una clase de 31 alumnas de secundaria (entre 14 y 15 años), que lo tratan más como un juguete que como un profesor.",15,0,34,2,2,2,55
Kujibiki Unbalance,none,none,4.1,10,OVA,https://www3.animeflv.net/uploads/animes/covers/1995.jpg,FINALIZADO,54,Comedia|Escolares|Romance,Kujibiki♥Unbalance (TV) (Historia Completa),3.0,"Kujibiki Unbalance es una ""serie dentro de una serie"", un anime dentro del mundo de Genshiken. Aquí, en el Instituto Rikkyoin, todos los problemas se solucionan mediante la suerte (kujibiki),incluso la selección de estudiantes se hace así. Esta es la historia de un estudiante de primer curso y los candidatos para ser los sucesores del consejo estudiantil, que también son elegidos por suerte, para obtener dicho puesto.",1,1,1,0,0,1,4
Akane Maniax,none,none,4.1,37,OVA,https://www3.animeflv.net/uploads/animes/covers/1711.jpg,FINALIZADO,215,Comedia|Mecha|Romance,Kimi ga Nozomu Eien (Historia Principal),3.0,"Spin-off de ""Kimi ga Nozomu Eien"" con Akane como protagonista. Un nuevo alumno llega al instituto Hakuryou: Gouda Jouji. Lo único que hará, aparte de torturarnos con sus berridos incesantes, será tirarle los tejos a Akane. ¿Logrará Akane deshacerse de este buitre que la acosa sin descanso?",7,0,2,0,0,0,9
Tales of Phantasia,テイルズ オブ ファンタジア THE ANIMATION,Tales of Phantasia - The Animation,4.6,28,OVA,https://www3.animeflv.net/uploads/animes/covers/398.jpg,FINALIZADO,306,Aventuras|Fantasía|Shounen,Tales of the Abyss (Spin-Off)|Tales of Vesperia The First Strike (Spin-Off),4.0,"Esta es la historia de Cless, Mint y Chester, cuyo mundo se encuentra en peligro debido a la resurrección de Dhaos, el dios del mal. Los protagonistas lucharán en una batalla junto a Arche y Klarth (procedentes del pasado y poseedores de la extinguida magia en la línea temporal de Cless y el resto) y Suzu (una ninja del futuro que busca venganza contra Dhaos). Juntos comenzarán un viaje para conocer los motivos y perversas intenciones de Dhaos para poder acabar con él de una vez por todas.",3,0,5,0,0,0,8
Howl no Ugoku Shiro,El Castillo Errante,ハウルの動く城,4.7,1092,PELÍCULA,https://www3.animeflv.net/uploads/animes/covers/1676.jpg,FINALIZADO,4276,Aventuras|Drama|Fantasía|Romance,,1.0,"El día que Sophie decide visitar a su hermana, tiene un encuentro desafortunado con un par de guardias, y es ayudada por un misterioso mago. Durante la huida, extraños hombres de goma comienzan a perseguirlos. Más tarde, Sophie se entera que su salvador no era nada más ni nada menos que el mago Howl, famoso por su afición por robar los corazones de las muchachas jóvenes. Esa misma noche, la Bruja Calamidad hace una visita nocturna a Sophie y le echa un maleficio, sometiéndola a ser una anciana a partir de ese día. Por esa misma razón, la chica decide dejar su casa y en su viaje hacia las montañas encuentra un castillo que vaga por los campos y valles, y comienza a trabajar ahí.",55,4,993,5,8,6,1071
Major,メジャー,none,4.5,206,ANIME,https://www3.animeflv.net/uploads/animes/covers/1649.jpg,FINALIZADO,1143,Comedia|Deportes|Drama|Shounen,Gekijouban Major: Yuujou no Winning Shot (Secuela)|Major 2 (Secuela),26.0,"Honda Shigeharu es un bateador en la cima de la Major League. Su hijo Goro es pitcher en una Little League y un día espera seguir los pasos de su padre. Hoshino Momoko es la maestra de Goro, y la primera mujer en la que Shigeharu ha estado interesado desde la muerte de la madre de Goro. Los destinos de estos tres individuos se entrelazaran como el padre y el hijo experimentan tanto angustia como triunfo sobre el diamante de béisbol. Pero cuando una tragedia visita la familia, romperá todo y ellos tendrán que recoger los pedazos y reclamar sus sueños.",12,1,22,1,2,0,38
Gakuen Alice,none,none,4.7,189,ANIME,https://www3.animeflv.net/uploads/animes/covers/1766.jpg,FINALIZADO,1275,Comedia|Escolares|Magia|Shoujo,,26.0,"Gakuen Alice es la historia de Mikan Sakura, una niña de 10 años, que en busca de su mejor amiga Imai Hotaru, ingresa de forma imprevista en una escuela muy especial y extraña. A ella sólo pueden entrar personas que posean un alice, es decir, un poder especial que puede ser de cualquier tipo, desde la telepatía o volar hasta controlar el fuego o convertirse en gato.",15,5,124,5,0,2,151
Maria-sama ga Miteru: Haru Specials,none,none,4.1,36,OVA,https://www3.animeflv.net/uploads/animes/covers/2043.jpg,FINALIZADO,142,Drama|Escolares|Recuentos de la vida|Romance|Shoujo|Yuri,Maria-sama ga Miteru: Haru (Historia Principal),6.0,Especiales de Maria-sama ga Miteru: Haru de los DvD.,1,0,8,1,0,0,10
