title,title_alternative1,title_alternative2,rating,votes,type_serie,cover,state,followers,categories,related,episodes,description,reactions_like,reactions_funny,reactions_love,reactions_surprise,reactions_angry,reactions_sad,reactions_total
Ikkitousen: Great Guardians,一騎当千 Great Guardians,Ikki Tousen: Great Guardians,4.4,99,ANIME,https://www3.animeflv.net/uploads/animes/covers/52.jpg,FINALIZADO,1266,Acción|Artes Marciales|Ecchi|Escolares|Superpoderes,Ikkitousen: Dragon Destiny (Precuela)|Ikkitousen: Xtreme Xecutor (Secuela),12.0,"Luego la batalla de los dragones, los colegios entran en una tregua volviendo la paz entre los luchadores; aunque nadie baja por completo la guardia. Hafuku que es oficialmente la cabecilla del colegio Nanyou, decide ir al tour de luchadoras en el exterior para ello deben reunir dinero para el viaje por lo que entre ella, Shimei y Koukin van a tomar un trabajo de medio tiempo. Por el otro lado, Unchou desea ir con su querida Gentoku a ""investigar"" pero al final terminan todos juntos a pasear por el barrio chino justamente donde trabajaba Hafuku; en eso una tierna y desconocida chica se hace presente diciendo que es la hermana menor de Hafuku... Chubou.",4,3,13,1,0,0,21
Tsumiki no Ie,none,none,4.7,67,PELÍCULA,https://www3.animeflv.net/uploads/animes/covers/1817.jpg,FINALIZADO,266,Drama,,1.0,"Un anciano vive en una ciudad casi inundada. Debido al incesante crecimiento del nivel del agua, debe construir constantemente una y otra planta más sobre su apartamento. Al realizar la última mudanza, se le cae su preciada pipa y decide bajar a rescatarla. Cuando logra recuperarla, inicia un viaje retrospectivo a través de los mejores momentos de su vida.",21,1,28,1,0,11,62
Candy Boy,Candy boy -Nonchalant talk of the certain twin sisters in daily life-,none,4.4,188,ANIME,https://www3.animeflv.net/uploads/animes/covers/23.jpg,FINALIZADO,2036,Escolares|Romance|Yuri,Candy☆Boy: Side Story For Archive (Precuela)|Candy Boy Episode: EX02 - Shiawase Kyouyuu Riron (Secuela),7.0,"Yukino y Kanade son hermanas gemelas que cursan el 2do año en el Colegio Comedy; además ambas comparten el mismo cuarto de la pensión. A pesar que son muy distintas en sus personalidades, desde que nacieron se han llevado muy bien... pero un día Kanade se entera que su hermana es seguida por una estudiante de 1er año, Sakuya, quien al parecer le está enamorada de ella. De a poco se da cuenta que la relación entre ellas se distancia...",32,3,75,2,8,1,121
Tennis no Ouji-sama: Zenkoku Taikai Hen - Final,テニスの王子様 Original Video Animation 全国大会編 Final,none,4.3,67,OVA,https://www3.animeflv.net/uploads/animes/covers/1597.jpg,FINALIZADO,395,Comedia|Deportes|Escolares|Shounen,Tennis no Ouji-sama: Zenkoku Taikai Hen - Semifinal (Precuela)|New Prince of Tennis (Secuela),6.0,"La Gran Final del Torneo Nacional. Aquí se encadenan partidos que están mas allá de la resistencia y la imaginación de cualquier individuo, se demuestra un nivel nunca antes visto.",4,0,22,0,0,0,26
Penguin Musume Heart,ペンギン娘♥はぁと,none,4.0,23,ANIME,https://www3.animeflv.net/uploads/animes/covers/163.jpg,FINALIZADO,283,Comedia|Ecchi|Escolares|Recuentos de la vida,,22.0,"Sakura Nankyoku, heredera de la corporación Nankyoku, llega a su nueva escuela y desde el primer día, en el que se presenta ante el curso entero en pijama, empiezan sus locas vivencias con sus nuevas amigas, mientras tiene que lidiar con la corporación Whitebear, encabezada por Mary Chupacabra W. Whitebear, quien trata de apoderarse de la ciudad y de destruir a Sakura y su corporación.",4,0,1,0,1,0,6
Junjou Romantica,純情ロマンチカ,Junjo Romantica,4.6,966,ANIME,https://www3.animeflv.net/uploads/animes/covers/135.jpg,FINALIZADO,8151,Comedia|Drama|Romance|Yaoi,Junjou Romantica 2 (Secuela),12.0,"Misaki Takahashi tiene problemas con sus estudios y necesita un tutor para poder acceder a la carrera de economía en la universidad.De esta forma, Akihiko Usami, un escritor de renombre y amigo de su hermano se convierte en su tutor.En un primer momento no se llevan demasiado bién, ya que Misaki Takahasi descubre que Akihiko Usami es gay, escribe novelas tipo ""boys love"" y además esta enamorado perdidamente de su hermano, al que usa en sus novelas eróticas. Lo que comienza con una mala relación poco a poco se ira transformando en un romance.Además en la misma linea argumental se incorporarán dos parejas mas relacionadas de alguna manera con la pareja protagonista y con la universidad donde estudia Misaki Takahashi. Así este anime nos mostrara 3 facetas diferentes de tres parejas distintas pero siempre con algo en común: la romántica ( Misaki Takahashi y Akihiko Usami), la egoista (Hiroki Kamijou y Nowaki Kusama ) y la terrorista (You Miyagi y Shinobu Takatsuki ).",71,17,1477,12,20,10,1607
Toshokan Sensou,none,none,4.7,109,ANIME,https://www3.animeflv.net/uploads/animes/covers/1405.jpg,FINALIZADO,777,Acción|Comedia|Militar|Romance,Toshokan Sensou: Kakumei no Tsubasa (Secuela),13.0,"En la era Seika (1989) con el fin de controlar las influencias negativas que podían ocasionar los medios de comunicación, se creo un control en contra de estos, en busca de proteger la libertad de expresión las Bibliotecas se militarizaron, esto promovió diferentes conflictos, hasta que el gobierno logra un tratado en el que permiten que en las Bibliotecas se tenga un libre acceso a los libros. Años después de esto Kasahara Iku una chica quien fue ayudada por un agente que protegió su libro favorito, por admiración a él, decide unirse a la Fuerza de la Defensa de la Biblioteca.",8,1,19,0,1,1,30
Real Drive,RD Sennou Chousashitsu,RD 潜脳調査室,4.1,24,ANIME,https://www3.animeflv.net/uploads/animes/covers/1263.jpg,FINALIZADO,291,Acción|Ciencia Ficción,,26.0,"Esta serie Neo-Futuristica de Ciencia ficción y Suspenso toma lugar en el Año 2061 cuando un nuevo y mejor sistema de información llamado The Material Network o Mejor dicho (Metal) ha tomado la sociedad humana. Este sistema comienza a tener problemas debido a individuos que se oponen la sistema. Unas personas llamadas ""Cyber Divers"" son enviados a investigar estos incidentes. La Protagonistas principales consisten en Mari un Cyber Diver, una chica llamada Minamo, el encargado del equipo Eiichir?, el experto en combates S?ta y el Androide Horon.",8,0,4,3,2,0,17
Monochrome Factor,none,none,4.4,224,ANIME,https://www3.animeflv.net/uploads/animes/covers/1391.jpg,FINALIZADO,1998,Acción|Sobrenatural|Yaoi,,24.0,"Akira Nikaido es un típico estudiante de instituto que piensa que tiene una vida normal, hasta que un misterioso hombre llamado Shirogane aparece y le pide encontrarse con él en la escuela al anochecer. Él es escéptico, pero va de todas maneras… en ese momento es atacado por una sombra monstruo! Shirogane le convence de que el equilibrio entre el mundo humano y el mundo en la sombra ha sido distorsionado, y que él debe convertirse en un shin (una criatura del mundo de la sombra, con el fin de ayudar a restablecer el equilibrio).",19,1,138,5,4,5,172
Vampire Knight,ヴァンパイア騎士,none,4.5,615,ANIME,https://www3.animeflv.net/uploads/animes/covers/476.jpg,FINALIZADO,5540,Drama|Misterio|Romance|Shoujo|Sobrenatural|Vampiros,Vampire Knight Guilty (Secuela),13.0,"Lo único que Yūki recuerda de su infancia es que, perdida en el invierno, fue atacada por un vampiro fuera de control, situación de la que la rescató otro vampiro, Kuran Kaname. Él la llevó con Kaien Cross, quien se convierte en su padre adoptivo y más adelante, en el director de la """"Academia Privada Cross"""". Sin embargo, la academia de elite oculta un secreto: los alumnos de la Clase de Noche son en realidad vampiros. El director y Kuran Kaname creen que es posible una convivencia pacífica de humanos y vampiros. Yūki y Zero, un chico procedente de una familia de cazadores de vampiros cuyos padres fueron asesinados por uno de ellos cuatro años atrás, son los únicos de la Clase de Día que conocen el secreto y se ocupan de mantener el orden en la Academia. Zero odia a los vampiros más que a nada en el mundo, pero a su vez también oculta un gran secreto que lo tortura día a día",39,2,285,7,6,1,340
Soul Eater,ソウルイーター,none,4.7,1375,ANIME,https://www3.animeflv.net/uploads/animes/covers/123.jpg,FINALIZADO,17524,Acción|Aventuras|Comedia|Fantasía|Shounen|Sobrenatural,,51.0,"En el Mundo de los Muertos, los altos cargos portan armas llamadas ""Guadañas Mortales"". Éstas se consiguen cuando el alma de una Guadaña (creada por un Técnico especialista) consigue comerse 99 almas humano-demonio y 1 alma de bruja. Pero la vida no siempre es fácil, ni para Técnicos ni para Guadañas, y puede costar trabajo llegar a ser una ""Guadaña Mortal"". Soul y Maka son los protagonistas de este anime (Soul el arma y Maka el técnico) junto con Black Star y su arma Tsubaki, y Death the Kid con las hermanas Thompson como armas (pistolas).",82,19,390,14,6,6,517
Nabari no Ou,隠の王,none,4.2,83,ANIME,https://www3.animeflv.net/uploads/animes/covers/142.jpg,FINALIZADO,940,Acción|Comedia|Drama|Fantasía|Shounen|Sobrenatural,,26.0,"Rokujou Miharu es un estudiante de instituto que vive en su propio mundo. Sin embargo, dentro de el, estaba al acecho el ultimo poder de Nabari, la ""Omnipotencia"". Para poseer tal arma suprema, el clan Iga jura llevar a Miharu a su pueblo. Por otro lado, el profesor de ingles de Miharu, Kumohira sensei, y el compañero de clase, Kouichi, pertenecen a los Banten ninjas cuya mision es proteger a Miharu. Una guerra sobre la propiedad de la ""Omnipotencia"" ha comenzado. Para sobrevivir, Miharu debe entrar en el mundo oculto de Nabari, y convertirse en rey.",9,2,30,2,0,1,44
Neo Angelique Abyss,ネオアンジェリーク Abyss,none,4.5,60,ANIME,https://www3.animeflv.net/uploads/animes/covers/564.jpg,FINALIZADO,800,Comedia|Fantasía|Harem|Romance|Shoujo,Neo Angelique Abyss Second Age (Secuela),13.0,"Si bien la joven Angelique vive sus días en paz en su escuela, los ataques de los monstruosos Thánatos han ido en aumento por todas partes. Dos Purificadores, los hombres con el poder de exterminar los Thánatos, aparecen un día. Uno de ellos, Nyx, intenta convencerla de unirse con ellos en su trabajo, ya que ella tiene el poder de la única mujer Purificadora pero Angelique duda. Entonces un Tánatos aparece en su escuela, Nyx y el otro Purificador, Rayne, luchan en una batalla perdida. Con sus compañeras de clase siendo presa del Thánatos, y los Purificadores siendo golpeados en su presencia, Angelique del deseo de salvarlos a todos despierta y se convirte en la única mujer Purificadora en la tierra de Arcadia, aquella conocida como el ""Queen's Egg"" (""Huevo de la Reina"").",8,0,17,0,1,0,26
https://www3.animeflv.net/anime/special-a,none,none,0,0,none,none,404 not found,0,,,0.0,none,0,0,0,0,0,0,0
Blassreiter,ブラスレイター,none,4.5,44,ANIME,https://www3.animeflv.net/uploads/animes/covers/208.jpg,FINALIZADO,603,Acción|Ciencia Ficción,,24.0,"La historia toma lugar en un futuro relativamente cercano, en Alemania. Han habido incidentes de personas muertas que vuelven a la vida transformándose en “sombras grotescas”(demonios), y atacando personas. Las personas vivientes pueden transformarse en demonios en el momento que deseen. Ellos solían ser humanos normales, pero cuando ganaron esta habilidad de transformación, las personas empezaron a rechazarlas y las llamaron demonios. Ahora, tienen que usar sus habilidades y aceptar su destino el cual es pelear una batalla épica contra otros que también se han convertido en demonios.",3,1,1,0,0,0,5
Code Geass: R2,コードギアス 反逆のルルーシュ R2,Code Geass: Lelouch of the Rebellion R2,4.7,1659,ANIME,https://www3.animeflv.net/uploads/animes/covers/30.jpg,FINALIZADO,4731,Acción|Ciencia Ficción|Drama|Mecha|Militar|Superpoderes,Code Geass (Precuela)|Code Geass: Nunnally in Wonderland (Historia Paralela),25.0,"Nos situamos en una realidad alternativa, donde el Imperio de Britania ha conquistado prácticamente todo el planeta. A los países subyugados bajo su poder opresor les ha arrebatado la libertad, los derechos e incluso el nombre. Área 11, ésa es la denominación que ahora tienen los japoneses. Allí, un joven llamado Lelouch comenzará su rebelión, el día en que por casualidad se topa con la misteriosa C.C., quien le concede un poder peculiar: El Geass, el poder de la absoluta obediencia. Basta con cruzar su mirada con la de su objetivo para que éste cumpla cualquier orden que Lelouch realice, sea cual sea, aunque signifique su propia destrucción.",18,9,231,5,0,11,274
Zettai Karen Children,絶対可憐チルドレン,Psychic Squad,4.3,42,ANIME,https://www3.animeflv.net/uploads/animes/covers/971.jpg,FINALIZADO,670,Acción|Comedia|Shounen|Sobrenatural,Courtesy of Zettai Karen Children  The Unlimited  Kyosuk (Historia Paralela),52.0,"En el futuro la gente que desarrolla ESP (poderes extrasensoriales) se han vuelto más comúnes. El gobierno japonés ha contratado a 3 de las mejores y más poderosas ESPers para que trabajen en B.A.B.E.L. (traducido: ""Base Laboratorio de Respaldo de ESP""), sin embargo, son sólo niñas de 10 años que aún cursan primaria y, para empeorar las cosas, no tienen precisamente el comportamiento más recatado del mundo.",5,1,7,0,1,0,14
Kamen no Maid Guy,仮面のメイドガイ,none,4.3,32,ANIME,https://www3.animeflv.net/uploads/animes/covers/156.jpg,FINALIZADO,297,Acción|Comedia|Ecchi|Superpoderes,,13.0,"La historia en cuestión gira en torno a Fujiwara Naeka, una joven de 17 años quien descubre que al cumplir 18 heredará una cuantiosa fortuna. Para evitar que Naeka corra peligro ahora que está a punto ser millonaria se contrata a un curioso guardaspalda, el cual tendrá que vestir como sirvienta para pasar desapercibido( lo cual no pasa). Este guardaespaldas cuenta con varios poderes anormales, como la vision del sirviente que puede ver desnudos a cualquier persona, ademas de no poseer sentido de la privacidad, por lo que traeria varias escenas ecchis.",1,0,5,0,1,0,7
Da Capo II Second Season,none,none,4.6,39,ANIME,https://www3.animeflv.net/uploads/animes/covers/1504.jpg,FINALIZADO,312,Comedia|Drama|Fantasía|Harem|Romance,Da Capo II (Precuela)|Da Capo III (Secuela)|T.P. Sakura: Time Paladin Sakura (Historia Paralela),13.0,"Esta segunda temporada trata sobre la vida de los protagonistas dos años después de la anterior serie, lo que trae algunos cambios. Los inmortales arboles de Sakura están de regreso, Basado en la secuela del juego original de PS2, la historia tiene lugar otra vez en el pueblo de Hatsunejima, pero después de 53 años de los eventos ocurridos en la D.C (Da capo) y D.C.S.S (Da Capo Second Graduation ó Da Capo Second Season). Aunque los personajes son algo familiares a simple vista hay nuevos personajes en el elenco. Siguen Junichi y las hermanas Yume y Otome Asakura ambas nietas de Junichi y Nemu de las primeras 2 series, Nemu solo es mencionada por nombre. Las cosas se complican cuando aparece Aisia, una niña que quiere que Junichi le enseñe magia, a pesar de que éste sólo sabe crear pequeños dulces japoneses de la nada.",5,0,4,0,0,0,9
Kanokon,かのこん,Kanokon - The Girl Who Cried Fox,4.5,512,ANIME,https://www3.animeflv.net/uploads/animes/covers/705.jpg,FINALIZADO,6999,Comedia|Ecchi|Escolares|Harem|Recuentos de la vida|Romance|Shounen|Sobrenatural,,12.0,"La historia de Kanokon gira alrededor de Kouta Oyamada, un joven de primer año de secundaria que se muda a la ciudad y se transfiere a la secundaria Kunpo. En su primer día en su nueva escuela, una hermosa chica de 2ndo año llamada Chizuru Minamoto le pide que la vea en el salón de música. Cuando el llega, ella le confiesa que ella en realidad es una zorra de naturaleza divina y desde ese día los dos empiezan a andar juntos. Nozomu es una chica de primer año en la escuela de Kouta, ella también es una loba de naturaleza divina enamorada de Kouta y es la rival de Chizuru por el afecto de Kouta",53,23,240,9,5,4,334
Druaga no Tou: the Aegis of Uruk,The Tower of Druaga: The Aegis of Uruk,ドルアーガの塔 ～the Aegis of URUK～,4.2,144,ANIME,https://www3.animeflv.net/uploads/animes/covers/1554.jpg,FINALIZADO,1756,Aventuras|Comedia|Fantasía,Druaga no Tou: the Sword of Uruk (Secuela),12.0,"Han pasado 60 años desde q el rey Gilgamesh venció ""La Torre"" por si solo, y ahora la torre a sido reconstruida. El verano de Anu es una temporada que se avecina una vez cada cierto tiempo en la que el poder de los monstruos de la torre se ve disminuido por la grace del gran dios Anu. Cada verano de Anu, las armadas del reino de Uruk se adentran dentro de la torre, esperando eventualmente el conquistar los niveles superiores de esta. La historia se lleva a cabo durante el tercer verano de Anu en la ciudad de Meskia, el primer establecimiento dentro de la torre en el primer nivel, donde incontable numero de aventureros llamados ""escaladores"" se preparan para alcanzar el mas alto de los niveles y así cumplir su sueño. Todo Comienza con Jil, un joven Guardián, quien desea derrotar a el dios Druaga, quien reside en el ultimo nivel, y asi obtener el legendario tesoro ""la vara de cristal azul"".",10,2,13,0,2,1,28
Itazura na Kiss,イタズラなKiss,none,4.6,788,ANIME,https://www3.animeflv.net/uploads/animes/covers/54.jpg,FINALIZADO,5116,Comedia|Romance|Shoujo,,25.0,"Cuenta la historia de amor de Kotoko Aihara y Naoki Irie, desde sus duros días de estudiantes de instituto hasta después de su matrimonio. La historia comienza cuando el padre de Kotoko al fin termina de construir una casa que resultó ser inestable, puesto que se derrumbó finalmente, a la vez que Kotoko daba una carta de amor al chico que le gusta, Naoki, pero obtuvo un rechazo en el pasillo del instituto frente a sus compañeros. Después de la humillación del momento, ella decide olvidarse de él. Entonces es cuando la casa de los Aihara se derrumba, y en la miseria son acogidos por un amigo del padre de Kotoko. Cuando llegan a la casa Kotoko se da cuenta que el amigo de su padre realmente es el padre de Naoki y vivirán juntos bajo el mismo techo.",59,11,282,7,4,2,365
Amatsuki,あまつき,none,4.4,53,ANIME,https://www3.animeflv.net/uploads/animes/covers/198.jpg,FINALIZADO,460,Acción|Fantasía|Historico|Shoujo|Sobrenatural,,13.0,"Tokidoki es un estudiante al que la historia se le da francamente mal. Así que para tratar de entender un poco mejor la historia de su país, acude a una impresionante simulación del período Edo en el que gracias a las nuevas tecnologías todo es tan real como si realmente hubiera viajado a esa época. Pero la simulación se vuelve realidad cuando Tokidoki se da cuenta de que ha quedado encerrado en ese mundo y no puede salir.",7,1,10,2,1,1,22
To Love Ru,To LOVEる -とらぶる-,To Loveru,4.6,1029,ANIME,https://www3.animeflv.net/uploads/animes/covers/6.jpg,FINALIZADO,14419,Ciencia Ficción|Comedia|Ecchi|Escolares|Harem|Romance,To LOVE-Ru OVA (Secuela),26.0,"La historia es acerca de Yuuki Rito, un muchacho de secundaria que no puede confesarse con la chica de sus sueños, Sairenji Haruna. Un día, cuando el regresó a casa y malhumorado, en la bañera, una misteriosa, chica desnuda, aparece de la nada. Su nombre es Lala y ella viene del planeta Deviluke, donde ella es la heredera al trono. Su padre quiere que ella vuelva a su planeta de origen, lo que le permite contraer matrimonio con uno de los candidatos a marido, pero ella decide que quiere casarse con Rito con el fin de permanecer en la Tierra.",87,43,477,16,11,8,642
Kure-nai,紅,Kurenai,4.4,87,ANIME,https://www3.animeflv.net/uploads/animes/covers/158.jpg,FINALIZADO,379,Artes Marciales|Comedia|Drama,,12.0,"Shintaro Kurenai, un chico de 16 años, es un mediador, un especialista en resolver disputas entre la gente. A pesar de ser tan joven y de ser muy despreocupado, es un chico con unas habilidades increíbles a la hora de proteger a sus clientes y a sus propios intereses. Entonces, un día, le presentan a la hija de una familia rica y poderosa, proponiéndole ser su guardaespaldas, que de alguna manera termina siendo el propietario de la niña de siete años, autoproclamándose su prometido.",4,0,8,1,0,2,15
Macross Frontier,マクロスfrontier,none,4.5,111,ANIME,https://www3.animeflv.net/uploads/animes/covers/307.jpg,FINALIZADO,639,Acción|Ciencia Ficción|Espacial|Mecha|Militar|Música|Romance,Macross Frontier: Itsuwari no Utahime (Resumen)|Macross FB7: Ginga Rukon - Ore no Uta wo Kike! (Historia Principal)|Macross Dynamite 7 (Precuela)|Macross Frontier Music Clip Shuu: Nyankuri (Historia Paralela)|Macross Δ (Secuela),25.0,"La historia se desarrolla en el año 2059, en la 25ª Flota De Emigracion, Macross Frontier. Macross Frontier (, Makurosu Furontia), es la continuación subsecuente de Macross 7, en el mundo de Macross. El VF-25 Messiah, es el ultimo ""variable fighter"" que aparece en esta serie contra el enemigo de turno que son los ""Vajra"".",8,0,10,1,2,0,21
Allison & Lillia,アリソンとリリア,Allison & Lillia,4.5,42,ANIME,https://www3.animeflv.net/uploads/animes/covers/269.jpg,FINALIZADO,188,Acción|Aventuras|Shounen,,26.0,"La historia se desarrolla en un mundo que se divide en don grandes regiones, la Confederación Roxcheanuk por el este y Reino Unido de Bezel Iltoa por el oeste, los cuales están en ?guerra? discutiendo en que continente se origina su raza. Allison es una chica Piloto con gran carácter, capaz de dominar a su querido y apacible amigo Will, joven estudioso y con una excelente puntería con las armas. Ambos se ven envuelto en una aventura cuando encuentran a un viejo que les indica que sabe el paradero de un tesoro invaluable, capaz de cambiar al mundo? Will sin saber como se encuentra en un avión piloteado por Allison hacia una gran aventura que sin duda cambiara la vida de ellos y de todas las personas?",3,0,7,0,0,0,10
Yu-Gi-Oh! 5D's,遊戯王5D`s,Yu-Gi-Oh! 5D`s,4.6,302,ANIME,https://www3.animeflv.net/uploads/animes/covers/969.jpg,FINALIZADO,1827,Acción|Juegos|Shounen,Yu-Gi-Oh! 3D Bonds Beyond Time (Historia Paralela)|Yu-Gi-Oh! GX (Secuela),154.0,"Mil años después de los hechos sucedidos en la serie original vemos una nueva versión de la ciudad Domino ahora llamada Neo Domino City, ahora vemos a un nuevo tipo de duelos los Riding Duels que son duelos a altas velocidades sobre motos llamadas D-Wheels, pero sin dejar atras los emocionantes torneos vemos a un nuevo protagonista intentando llegar a Neo Domino City para encontrar su destino.",22,2,49,1,0,3,77
Chi's Sweet Home,チーズスイートホーム,none,4.7,101,ANIME,https://www3.animeflv.net/uploads/animes/covers/282.jpg,FINALIZADO,881,Comedia|Recuentos de la vida,,104.0,"Un minino gris y blanco con rayas negras se pierde de su madre y hermanos un día mientras salieron a caminar tranquilamente. Perdido en los alrededores, el minino pelea para encontrar a su familia pero en vez de eso encuentra a un joven chico, Yohei, y a su madre. Ellos toman a la minina a casa, pero las mascotas no son permitidas en el complejo de apartamentos, así que ellos tratan de encontrarle un nuevo hogar a la gatita. Esto se vuelve difícil para la familia, que eventualmente decide quedarse con ella nombrándola ?Chi?.",8,1,54,1,0,1,65
Saishuu Shiken Kujira Progressive,none,none,4.1,15,OVA,https://www3.animeflv.net/uploads/animes/covers/2308.jpg,FINALIZADO,87,Drama|Romance,Saishuu Shiken Kujira (Historia Principal),1.0,,5,0,7,0,0,1,13
Hokuto no Ken: Toki-den,none,none,3.9,16,OVA,https://www3.animeflv.net/uploads/animes/covers/1524.jpg,FINALIZADO,85,Acción|Artes Marciales,(Precuela)|Hokuto no Ken: Zero Kenshiro Den (Secuela),1.0,La cuarta parte de la nueva Pentalogía de Hokuto no Ken.,4,1,5,0,2,0,12
To Heart 2 AD,none,none,4.1,19,OVA,https://www3.animeflv.net/uploads/animes/covers/2181.jpg,FINALIZADO,160,Comedia|Ecchi|Romance,To Heart 2 OVA (Precuela)|To Heart 2 AD Plus (Secuela),2.0,"Segunda tanda de OVAs de la serie de To Heart 2, dedicadas principalmente a Tama-nee y Yuma.",2,0,9,1,2,0,14
.hack//G.U.Trilogy,.hack//G.U. Trilogy,none,4.3,38,PELÍCULA,https://www3.animeflv.net/uploads/animes/covers/619.jpg,FINALIZADO,293,Acción|Ciencia Ficción|Fantasía|Juegos,.hack//Roots (Precuela),1.0,"La trama sigue centrándose en Haseo, quien ya se dio cuenta de que ""The World R:2"" no es un juego común y corriente, ya que el fenómeno del ""AIDA"" afecta a los jugadores en la vida real de forma peligrosa. Para salvar a su amiga Shino, Haseo tratara de encontrar alguna respuesta pero solo se topara con mas misterios que rodean a este popular mundo.",5,1,13,1,0,4,24
Shigofumi Picture Drama,none,none,4.6,14,ANIME,https://www3.animeflv.net/uploads/animes/covers/2627.jpg,FINALIZADO,78,Comedia,Shigofumi (Historia Principal),7.0,Historias extra exclusivas de los DVD.,4,0,1,0,0,0,5
Bus Gamer,none,none,3.6,30,OVA,https://www3.animeflv.net/uploads/animes/covers/559.jpg,FINALIZADO,106,Acción,,3.0,"Toki Mishiba, Nobuto Nakajyo y Kazuo Saitoh son tres jóvenes contratados por una compañía de negocios para que jueguen al Bus Gamer, un juego donde se compite para proteger un disco o robarlo. Los equipos se dividen en HOME, que es el que protege el disco y AWAY, el que roba el disco. Hay un tiempo límite para el juego.",10,3,10,2,3,0,28
