title,title_alternative1,title_alternative2,rating,votes,type_serie,cover,state,followers,categories,related,episodes,description,reactions_like,reactions_funny,reactions_love,reactions_surprise,reactions_angry,reactions_sad,reactions_total
Koisuru Asteroid,Koisuru Shouwakusei,恋する小惑星〈アストロイド〉,4.5,418,ANIME,https://www3.animeflv.net/uploads/animes/covers/3233.jpg,FINALIZADO,3379,Comedia|Escolares|Recuentos de la vida,,12.0,"Cuando era niña, Mira Konohata participó en un campamento local y conoció allí a un chico llamado Ao. Mientras miraban juntos el cielo estrellado, Ao le comenta a Mira que probablemente exista una estrella que tiene el mismo nombre que ella. Sin embargo, como hasta ese momento aún no existe dicha estrella, prometen que algún día descubrirán un asteroide y lo nombrarán Mira. Algunos años después, cuando Mira se inscribe a la Preparatoria Hoshizaki, decide unirse al Club de Astronomía con el objetivo de cumplir con la promesa. Sin embargo, pronto descubre que, en ese año, el Club de Astronomía se fusionará con la Sociedad de Investigación de Geología para formar el Club de Ciencias de la Tierra. Sin opciones, se va a la sala del club en donde conoce a Ao Manaka, quien resulta ser la persona con la que había hecho la promesa hacía muchos años y que, además, ¡era en realidad una chica! Ahora las dos se unen con Mari Morino (una chica de tercer año que era parte del Club de Astronomía), Mai Inose y Mikage Sakurai (de segundo y tercer año, respectivamente) para finalmente dar inicio al Club de Ciencias de la Tierra.",31,0,80,2,4,3,120
Darwin's Game,ダーウィンズゲーム,none,4.7,2902,ANIME,https://www3.animeflv.net/uploads/animes/covers/3234.jpg,FINALIZADO,18072,Acción|Shounen|Suspenso,,11.0,"La vida de Kaname Sudo cambia cuando recibe una invitación en su móvil para participar en un juego. Tan pronto como es mordido por una serpiente virtual que aparece en la pantalla de su teléfono, se convierte en esclavo de una competencia despiadada,”Darwin’s Game”, un verdadero espacio urbano en el que los participantes interconectados a través de una red social compiten en duelos hasta la muerte. Muy rápidamente, el estudiante de instituto debe enfrentar el hecho: incluso si intenta escapar del juego, sus oponentes, atraídos por el atractivo del dinero y la emoción de la pelea, están listos para hacer cualquier cosa para encontrarlo.",160,9,581,18,5,6,779
Re:Zero kara Hajimeru Isekai Seikatsu: Shin Henshuu-ban,Re：ゼロから始める異世界生活新編集版,none,4.6,1796,ANIME,https://www3.animeflv.net/uploads/animes/covers/3231.jpg,FINALIZADO,13492,Drama|Fantasía|Psicológico,,13.0,Segunda versión de la primera temporada con algunas escenas extra.,137,19,646,25,17,17,861
Pokemon (2019),Pocket Monsters,ポケットモンスター,4.4,2089,ANIME,https://www3.animeflv.net/uploads/animes/covers/3229.jpg,EN EMISION,19252,Acción|Aventuras|Comedia|Fantasía|Infantil,Pokemon Sun & Moon (Precuela),109.0,"Nueva temporada de Pokémon, titulada como la serie original de 1997.",680,104,1965,82,111,49,2991
ReZero kara Hajimeru Isekai Seikatsu - Hyouketsu no Kizuna,"Re:ZERO: Starting Life in Another World - Frozen Bonds, Re:Zero kara Hajimeru Isekai Seikatsu OVA 2",Re：ゼロから始める異世界生活『氷結の絆』,4.7,856,OVA,https://www3.animeflv.net/uploads/animes/covers/3285.jpg,FINALIZADO,4548,Drama|Fantasía|Psicológico,,1.0,El episodio girará en torno a Emilia y su reunión con Puck durante el viaje a la Mansión Roswaal para ser candidata a la elección real.,88,12,465,17,16,7,605
Psycho-Pass 3,PSYCHO-PASS サイコパス 3,none,4.6,711,ANIME,https://www3.animeflv.net/uploads/animes/covers/3225.jpg,FINALIZADO,6754,Acción|Ciencia Ficción|Policía|Psicológico,,8.0,"En un futuro próximo, es posible medir de forma instantánea el estado mental de una persona, la personalidad y la probabilidad de que dicha persona vaya a cometer delitos gracias a un escáner psico-somático que realiza un escaneo de las funciones del cerebro y demás funciones biológicas y químicas del cuerpo, determinando el Psycho-Pass, un número asociado a un matiz en cada persona. Cuando esta probabilidad, medida como el índice de “Coeficiente de Criminalidad”, es demasiado alta, es decir, posee un matiz muy oscuro y un número muy elevado, los individuos son perseguidos y detenidos con fuerza letal si es necesario.",27,3,97,6,6,0,139
Chihayafuru 3,Chihayafull 3,ちはやふる 3,4.6,470,ANIME,https://www3.animeflv.net/uploads/animes/covers/3224.jpg,FINALIZADO,2211,Deportes|Drama|Escolares|Josei|Juegos|Recuentos de la vida,,24.0,Tercera temporada.,7,2,63,3,0,2,77
Rifle Is Beautiful,Chidori RSC,ライフル・イズ・ビューティフル,4.1,396,ANIME,https://www3.animeflv.net/uploads/animes/covers/3222.jpg,FINALIZADO,2922,Comedia|Escolares|Recuentos de la vida,,12.0,"Kokura Hikari es una chica de primer año de preparatoria a quien le encanta el tiro con rifle. Decidió entrar a la Preparatoria Chidori debido a que sabía que la escuela contaba con un club de tiro, sin embargo, justo después de ingresar se da cuenta que el club se ha disuelto. Es entonces cuando, además, se entera de que si desea reinstituir el club necesita encontrar miembros suficientes en menos de un día. Afortunadamente, logra encontrar a otras tres chicas de primer año que había conocido en una competencia de tiro en la escuela secundaria. Es así como comenzarán las actividades diarias del nuevo Club de Tiro con Rifle de la Preparatoria Chidori.",9,4,27,3,2,1,46
Boku no Hero Academia 4th Season,My Hero Academia 4,僕のヒーローアカデミア 4thシーズン,4.7,6553,ANIME,https://www3.animeflv.net/uploads/animes/covers/3220.jpg,FINALIZADO,59252,Acción|Comedia|Escolares|Shounen|Superpoderes,Boku no Hero Academia 3rd Season (Precuela)|Boku no Hero Academia the Movie 2: Heroes:Rising (Historia Paralela)|Boku no Hero Academia 5th Season (Secuela),25.0,Cuarta tempo de Boku no Hero Academia.,695,118,5742,153,70,87,6865
Sword Art Online: Alicization - War of Underworld,"Sword Art Online: Alicization 2nd Season, Sword Art Online III 2nd Season, SAO Alicization 2nd Season, Sword Art Online 3 2nd Season, SAO 3 2nd Season",ソードアート・オンライン アリシゼーション War of Underworld,4.7,5391,ANIME,https://www3.animeflv.net/uploads/animes/covers/3221.jpg,FINALIZADO,28694,Acción|Aventuras|Fantasía|Juegos|Romance,Sword Art Online: Alicization (Precuela),23.0,Segunda parte de Sword Art Online: Alicization,339,41,2531,65,43,51,3070
Shokugeki no Souma: Shin no Sara,Shokugeki no Soma 4th Season,食戟のソーマ 神ノ皿,4.7,2182,ANIME,https://www3.animeflv.net/uploads/animes/covers/3217.jpg,FINALIZADO,14409,Ecchi|Escolares|Shounen,Shokugeki no Souma: San no Sara - Toutsuki Ressha-hen (Precuela)|Shokugeki no Souma: Gou no Sara (Secuela),12.0,Cuarta temporada de Shokugeki no Souma.,72,23,597,13,6,3,714
Shin Chuuka Ichiban!,New Cooking Master Boy,真・中華一番!,3.7,274,ANIME,https://www3.animeflv.net/uploads/animes/covers/3218.jpg,FINALIZADO,1350,Comedia|Shounen,Shin Chuuka Ichiban! 2nd Season (Secuela),12.0,"Después de pasar las Pruebas Especiales de Chef de Guangzhou, Mao decidió viajar por China para aprender más sobre la preparación única de los alimentos. A su regreso, aprenderá que la verdadera batalla acaba de comenzar. La Sociedad de Cocina Subterránea ya comenzó a moverse ...",12,2,11,5,6,0,36
Kabukichou Sherlock,Case File nº221: Kabukicho,歌舞伎町シャーロック,4.4,543,ANIME,https://www3.animeflv.net/uploads/animes/covers/3219.jpg,FINALIZADO,5850,Comedia|Drama|Misterio,,24.0,"La historia dará comienzo siguiendo a Watson, un doctor al que despiden de su trabajo en el hospital tras verse involucrado en cierto incidente. Watson busca entonces al detective Sherlock, visitando cierto bar. La zona este de Shinjuku… El barrio de Kabuki-cho brilla con sus luces de neón en el centro de esta caótica ciudad. Pero donde brilla la luz, también acechan las sombras. Se alza el telón de este escenario nocturno donde los extraños asesinatos se suceden uno tras otro. ¿Es una historia de suspense? No, ¿una comedia? Un drama indistinguible está a punto de comenzar…",14,2,29,3,1,0,49
Assassins Pride,アサシンズプライド,none,4.5,2267,ANIME,https://www3.animeflv.net/uploads/animes/covers/3213.jpg,FINALIZADO,22159,Fantasía,,12.0,"Solo aquellos procedentes de linajes de familias nobles tienen la capacidad de enfrentar a los monstruos. Kufa es un noble nacido en la familia de un duque a quien envían como tutor de una joven llamada Merida. Merida no tiene talento alguno con el maná, lo que hace que en realidad la misión secreta y real de Kufa sea asesinarla.",146,24,599,20,11,7,807
Gundam Build Divers Re:Rise,ガンダムビルドダイバーズRe:RISE,none,4.0,169,OVA,https://www3.animeflv.net/uploads/animes/covers/3212.jpg,FINALIZADO,1173,Acción|Ciencia Ficción|Mecha,Gundam Build Divers (Precuela)|Gundam Build Divers Re:Rise 2nd Season (Secuela),13.0,Segunda temporada de Gundam Build Divers,6,0,8,1,1,0,16
No Guns Life,ノー・ガンズ・ライフ,none,4.6,913,ANIME,https://www3.animeflv.net/uploads/animes/covers/3214.jpg,FINALIZADO,11658,Acción|Ciencia Ficción|Seinen,No Guns Life 2nd Season (Secuela),12.0,"Después de la guerra, hay muchos “extends” en la ciudad, personas cuyos cuerpos fueron modificados para convertirlos en armas peligrosas. Inui Juuzou es uno de ellos, y no tiene recuerdos de su vida y cuerpo antes de que su cabeza se transformara en un arma. Por extraño que parezca, su pistola ubicada en la cabeza está diseñada para que solo alguien detrás de él pueda apretar el gatillo. En la actualidad, Juuzou se gana la vida tomando casos que involucran a extends en la ciudad, y es asistido por Mary, una joven inteligente que ha tomado bajo su protección.",36,5,75,10,6,4,136
Hoshiai no Sora,Stars Align,星合の空,4.7,1261,ANIME,https://www3.animeflv.net/uploads/animes/covers/3215.jpg,FINALIZADO,9050,Deportes|Drama|Escolares|Recuentos de la vida,,12.0,"La historia juvenil gira en torno a los integrantes de un equipo del Club de Soft Tenis escolar que está a punto de cerrar. Toma Shinjou le pide a Maki Katsuragi que se una al equipo debido a sus habilidades, y menciona una competencia de verano. Sin embargo, Katsuragi pide dinero a cambio de unirse al equipo.",70,9,656,13,10,38,796
BEASTARS,none,none,4.6,3091,ANIME,https://www3.animeflv.net/uploads/animes/covers/3226.jpg,FINALIZADO,19594,Drama|Psicológico|Recuentos de la vida|Shounen,,12.0,"En un mundo poblado por animales antropomórficos, conviven herbívoros y carnívoros. Para los adolescentes de la Academia Cherryton, la vida escolar está llena de esperanza, romance, desconfianza e inquietud. El personaje principal es Legoshi el lobo, miembro del club de teatro. A pesar de su apariencia amenazante, tiene un corazón muy gentil. Durante la mayor parte de su vida, siempre ha sido objeto de temor y odio de otros animales, y se ha acostumbrado bastante a ese estilo de vida. Pero después del asesinato de un compañero de clase, se encuentra cada vez más involucrado con sus otros compañeros, que tienen su propia cuota de inseguridades, y encuentra que su vida en la escuela cambia lentamente.",320,44,1301,61,58,27,1811
Nanatsu no Taizai: Kamigami no Gekirin,The Seven Deadly Sins: Wrath of the Gods,七つの大罪 神々の逆鱗,4.1,4995,ANIME,https://www3.animeflv.net/uploads/animes/covers/3211.jpg,FINALIZADO,44535,Acción|Aventuras|Fantasía|Magia|Shounen|Sobrenatural,Nanatsu no Taizai: Imashime no Fukkatsu (Precuela)|Nanatsu no Taizai: Fundo no Shinpan (Secuela),24.0,Nueva temporada de Nanatsu no Taizai,272,44,1330,37,124,36,1843
Mugen no Juunin: Immortal,Blade of the Immortal,無限の住人-IMMORTAL-,4.7,939,OVA,https://www3.animeflv.net/uploads/animes/covers/3216.jpg,FINALIZADO,9938,Acción|Artes Marciales|Aventuras|Drama|Historico|Samurai|Seinen|Sobrenatural,,24.0,"La historia del manga original está protagonizada por Manji, un ronin maldito con la inmortalidad debido a unos gusanos que le introdujeron en su cuerpo. Para poder redimirse por sus actos en vida, tendrá que acabar con un gran número de criminales. En su camino conoce a Rin, una joven que busca vengarse del grupo de bandidos que mató a su familia, y sin saber muy bien cómo, acaba siendo acompañante de Manji.",54,3,109,13,4,7,190
Kandagawa Jet Girls,神田川JET GIRLS,none,4.2,374,ANIME,https://www3.animeflv.net/uploads/animes/covers/3210.jpg,FINALIZADO,3024,Deportes,,12.0,"Rin Namiki es hija de una Jetter legendaria y sueña con seguir los pasos de su madre, así que abandona su isla natal y parte a Asakusa, en Tokio. Tras conocer a la hermosa Misa Aoi, ambas formarán equipo para competir y llegar a lo más alto.",4,2,23,0,1,0,30
Z/X: Code Reunion,Z/X Code Reunion,none,4.0,326,ANIME,https://www3.animeflv.net/uploads/animes/covers/3209.jpg,FINALIZADO,3468,Ciencia Ficción|Escolares|Fantasía|Shounen,,12.0,"La historia tiene lugar en un futuro próximo en el cual la Tierra ha sido invadida por extrañas criaturas que emergen de los cinco llamados “Puntos Negros“, puertas interdimensionales conectadas a mundos paralelos. El objetivo de la invasión es eliminar otros mundos paralelos para así aumentar la posibilidad de converger en un mismo futuro. Para contraatacar y defender el planeta, cinco adolescentes serán los responsables de invocar a héroes y monstruos mediante unos dispositivos de cartas llamados Z/X.",12,0,17,1,1,0,31
Stand My Heroes: Piece of Truth,スタンドマイヒーローズ PIECE OF TRUTH,none,3.7,417,ANIME,https://www3.animeflv.net/uploads/animes/covers/3208.jpg,FINALIZADO,3713,Josei|Misterio|Romance,,12.0,"Izumi Rei, a.k.a Matori, es una nueva oficial que trabaja bajo el Departamento de Control de Narcóticos del Ministerio de Salud. Los narcóticos no funcionan en ella, y la historia comienza cuando ingresa al departamento y comienza a trabajar con otros agentes.",32,3,99,6,7,3,150
